[
  {
    "id": "game-engine",
    "label": "GameEngine",
    "references": [],
    "description": "ゲーム開発に必要な描画・物理・入力などを統合した基盤ソフトウェアの総称。"
  },
  {
    "id": "unity",
    "label": "Unity",
    "references": [
      "game-engine",
      "csharp",
      "windows",
      "macos",
      "linux",
      "ios",
      "android",
      "webgl",
      "playstation",
      "xbox",
      "nintendo-switch",
      "written-in-cpp",
      "runs-on-windows",
      "runs-on-macos",
      "runs-on-linux",
      "2d-rendering",
      "3d-rendering",
      "physics",
      "built-in-gui-editor",
      "physx",
      "box2d",
      "unity-technologies"
    ],
    "description": "世界で最も普及した汎用ゲームエンジン。2D/3D両対応でモバイルからコンソールまで幅広く展開できる。"
  },
  {
    "id": "unreal-engine",
    "label": "Unreal Engine",
    "references": [
      "game-engine",
      "cpp",
      "blueprints",
      "windows",
      "macos",
      "linux",
      "ios",
      "android",
      "playstation",
      "xbox",
      "nintendo-switch",
      "written-in-cpp",
      "runs-on-windows",
      "runs-on-macos",
      "runs-on-linux",
      "3d-rendering",
      "physics",
      "built-in-gui-editor",
      "chaos",
      "epic-games"
    ],
    "description": "Epic Games製のハイエンドエンジン。フォトリアルな3D表現とBlueprintsが強み。"
  },
  {
    "id": "godot",
    "label": "Godot",
    "references": [
      "game-engine",
      "gdscript",
      "csharp",
      "windows",
      "macos",
      "linux",
      "ios",
      "android",
      "webgl",
      "written-in-cpp",
      "runs-on-windows",
      "runs-on-macos",
      "runs-on-linux",
      "2d-rendering",
      "3d-rendering",
      "physics",
      "built-in-gui-editor",
      "open-source"
    ],
    "description": "軽量・無料のオープンソースエンジン。独自のGDScriptとシーンツリー構造が特徴。"
  },
  {
    "id": "defold",
    "label": "Defold",
    "references": [
      "game-engine",
      "lua",
      "windows",
      "macos",
      "linux",
      "ios",
      "android",
      "webgl",
      "playstation",
      "nintendo-switch",
      "written-in-cpp",
      "runs-on-windows",
      "runs-on-macos",
      "runs-on-linux",
      "2d-rendering",
      "physics",
      "built-in-gui-editor",
      "box2d",
      "defold-foundation"
    ],
    "description": "King発・現Defold Foundation運営の2D特化エンジン。軽量バイナリとコンソール公式対応が光る。"
  },
  {
    "id": "bevy",
    "label": "Bevy",
    "references": [
      "game-engine",
      "rust",
      "windows",
      "macos",
      "linux",
      "ios",
      "android",
      "webgl",
      "written-in-rust",
      "runs-on-windows",
      "runs-on-macos",
      "runs-on-linux",
      "2d-rendering",
      "3d-rendering",
      "cargo",
      "open-source"
    ],
    "description": "Rust製のデータ駆動(ECS)エンジン。コードファーストで専用エディタを持たない。"
  },
  {
    "id": "ebitengine",
    "label": "Ebitengine",
    "references": [
      "game-engine",
      "go",
      "windows",
      "macos",
      "linux",
      "ios",
      "android",
      "webgl",
      "nintendo-switch",
      "written-in-go",
      "runs-on-windows",
      "runs-on-macos",
      "runs-on-linux",
      "2d-rendering",
      "hajime-hoshi",
      "open-source"
    ],
    "description": "星一氏が個人開発するGo製2Dエンジン。「シンプルであること」を哲学に掲げる。"
  },
  {
    "id": "siv3d",
    "label": "Siv3D",
    "references": [
      "game-engine",
      "cpp",
      "windows",
      "macos",
      "linux",
      "webgl",
      "written-in-cpp",
      "runs-on-windows",
      "runs-on-macos",
      "runs-on-linux",
      "2d-rendering",
      "3d-rendering",
      "physics",
      "box2d",
      "ryo-suzuki"
    ],
    "description": "鈴木遼氏によるC++フレームワーク。創作と学習のために洗練されたAPIを持つ。"
  },
  {
    "id": "gamemaker",
    "label": "GameMaker",
    "references": [
      "game-engine",
      "gml",
      "windows",
      "macos",
      "linux",
      "ios",
      "android",
      "webgl",
      "playstation",
      "xbox",
      "nintendo-switch",
      "written-in-cpp",
      "runs-on-windows",
      "runs-on-macos",
      "2d-rendering",
      "physics",
      "built-in-gui-editor",
      "box2d",
      "yoyo-games"
    ],
    "description": "2Dゲーム制作の老舗。専用言語GMLとGUIエディタで素早く形にできる。"
  },
  {
    "id": "roblox-engine",
    "label": "Roblox Engine",
    "references": [
      "game-engine",
      "luau",
      "roblox",
      "written-in-cpp",
      "runs-on-windows",
      "runs-on-macos",
      "3d-rendering",
      "physics",
      "built-in-gui-editor",
      "roblox-corporation"
    ],
    "description": "Roblox専用の開発環境(Roblox Studio)。Luauで書き、Robloxプラットフォームへ公開する。"
  },
  {
    "id": "cocos2d",
    "label": "Cocos2D",
    "references": [
      "game-engine",
      "cpp",
      "windows",
      "macos",
      "linux",
      "ios",
      "android",
      "webgl",
      "written-in-cpp",
      "runs-on-windows",
      "runs-on-macos",
      "2d-rendering",
      "physics",
      "box2d",
      "open-source"
    ],
    "description": "中国圏で存在感の強い2Dエンジン(cocos2d-x想定)。C++コアにLua/JSバインディング。"
  },
  {
    "id": "phaser",
    "label": "Phaser",
    "references": [
      "game-engine",
      "javascript",
      "webgl",
      "runs-on-windows",
      "runs-on-macos",
      "runs-on-linux",
      "2d-rendering",
      "physics",
      "npm",
      "richard-davey",
      "open-source"
    ],
    "description": "Webブラウザ向け2Dゲームフレームワークの定番。JavaScriptで書きnpmで配布される。"
  },
  {
    "id": "scratch",
    "label": "Scratch",
    "references": [
      "game-engine",
      "programming-language",
      "visual-scripting",
      "webgl",
      "2d-rendering",
      "built-in-gui-editor",
      "scratch-foundation",
      "open-source",
      "ugc"
    ],
    "description": "MIT発のビジュアルプログラミング環境。ブロックを繋いでゲームを作る、プログラミング教育の入口。"
  },
  {
    "id": "programming-language",
    "label": "ProgrammingLanguage",
    "references": [],
    "description": "コンピュータへの命令を記述するための形式言語の総称。"
  },
  {
    "id": "csharp",
    "label": "C#",
    "references": [
      "programming-language",
      "cpp",
      "dotnet",
      "microsoft",
      "oop"
    ],
    "description": "Microsoft製のオブジェクト指向言語。.NET上で動き、Unityのスクリプト言語として有名。"
  },
  {
    "id": "cpp",
    "label": "C++",
    "references": [
      "programming-language",
      "c",
      "oop"
    ],
    "description": "Cにオブジェクト指向などを加えた高性能言語。ゲームエンジン実装の覇者。"
  },
  {
    "id": "blueprints",
    "label": "Blueprints",
    "references": [
      "programming-language",
      "visual-scripting"
    ],
    "description": "Unreal Engineのビジュアルスクリプティング。ノードを繋いでロジックを組む。"
  },
  {
    "id": "gdscript",
    "label": "GDScript",
    "references": [
      "programming-language",
      "python"
    ],
    "description": "Godot専用のスクリプト言語。Python風の文法で書きやすい。"
  },
  {
    "id": "lua",
    "label": "Lua",
    "references": [
      "programming-language"
    ],
    "description": "組み込み用途に特化した軽量スクリプト言語。ゲーム業界での採用例多数。"
  },
  {
    "id": "rust",
    "label": "Rust",
    "references": [
      "programming-language",
      "functional-programming"
    ],
    "description": "所有権システムでメモリ安全を保証するシステム言語。関数型の影響も色濃い。"
  },
  {
    "id": "go",
    "label": "Go",
    "references": [
      "programming-language",
      "google"
    ],
    "description": "Google製のシンプルさ重視の言語。並行処理と高速コンパイルが持ち味。"
  },
  {
    "id": "gml",
    "label": "GML",
    "references": [
      "programming-language"
    ],
    "description": "GameMaker専用のスクリプト言語。"
  },
  {
    "id": "luau",
    "label": "Luau",
    "references": [
      "programming-language",
      "lua"
    ],
    "description": "RobloxによるLua方言。型注釈と高速化が加えられている。"
  },
  {
    "id": "javascript",
    "label": "JavaScript",
    "references": [
      "programming-language"
    ],
    "description": "Webブラウザの共通言語。ゲームもツールもこれ一本で動く。"
  },
  {
    "id": "visual-scripting",
    "label": "VisualScripting",
    "references": [
      "programming-language"
    ],
    "description": "コードの代わりにノードやブロックで処理を組む方式の総称。"
  },
  {
    "id": "c",
    "label": "C",
    "references": [
      "programming-language"
    ],
    "description": "1972年生まれのシステムプログラミング言語。多くの言語とOSの祖。"
  },
  {
    "id": "python",
    "label": "Python",
    "references": [
      "programming-language"
    ],
    "description": "読みやすさ重視の汎用言語。GDScriptの文法に影響を与えた。"
  },
  {
    "id": "monobehaviour",
    "label": "MonoBehaviour",
    "references": [
      "unity",
      "csharp"
    ],
    "description": "Unityスクリプトの基底クラス。コンポーネントとしてGameObjectにぶら下がる。"
  },
  {
    "id": "unreal-cpp",
    "label": "Unreal C++",
    "references": [
      "unreal-engine",
      "cpp"
    ],
    "description": "UE流のC++。リフレクションやGCをマクロ群で実現する独自方言。"
  },
  {
    "id": "platform",
    "label": "Platform",
    "references": [],
    "description": "ゲームが動作する環境(OS・ハード・サービス)の総称。このマップではビルド先の意味で使う。"
  },
  {
    "id": "windows",
    "label": "Windows",
    "references": [
      "platform"
    ],
    "description": "PCゲームの最大市場を持つMicrosoft製OS。"
  },
  {
    "id": "macos",
    "label": "macOS",
    "references": [
      "platform",
      "apple"
    ],
    "description": "Apple製のデスクトップOS。"
  },
  {
    "id": "linux",
    "label": "Linux",
    "references": [
      "platform",
      "open-source"
    ],
    "description": "オープンソースOSの代表。Steam Deckの土台でもある。"
  },
  {
    "id": "ios",
    "label": "iOS",
    "references": [
      "platform",
      "apple",
      "smartphone"
    ],
    "description": "AppleのモバイルOS。iPhone/iPadで動く。"
  },
  {
    "id": "android",
    "label": "Android",
    "references": [
      "platform",
      "google",
      "linux",
      "smartphone"
    ],
    "description": "GoogleのモバイルOS。Linuxカーネルの上に築かれている。"
  },
  {
    "id": "webgl",
    "label": "WebGL",
    "references": [
      "platform"
    ],
    "description": "ブラウザ上で2D/3D描画を行うAPI。インストール不要で配布できるのが強み。"
  },
  {
    "id": "playstation",
    "label": "PlayStation",
    "references": [
      "platform"
    ],
    "description": "ソニー(SIE)の家庭用ゲーム機ブランド。"
  },
  {
    "id": "xbox",
    "label": "Xbox",
    "references": [
      "platform"
    ],
    "description": "Microsoftの家庭用ゲーム機ブランド。"
  },
  {
    "id": "nintendo-switch",
    "label": "Nintendo Switch",
    "references": [